{
  "meta": {
    "run_at": "2026-10-03",
    "model": "claude-opus-5-5",
    "prompt": "audit-v0.4",
    "note": "Experimental benchmark run. No human has verified it. Several key papers were read only as abstracts (VITAL, ASCEND, Cochrane 2020, Gencer 2021, VITAL Rhythm, STRENGTH, UK Biobank cohort). The NEJM and PMC full texts of VITAL were blocked (403 and captcha). The Hu 2019 meta-analysis and the 2023 VITAL win-ratio paper were read in full through a summarising fetch tool, so table-level details may be compressed. The NIH ODS fact sheet page returned 403, so its position comes from a search snippet."
  },
  "product": "Fish oil omega-3, 1000 mg EPA+DHA per day (supplied regimen)",
  "ingredient": "omega-3 (EPA+DHA)",
  "form": "Fish oil providing EPA+DHA. Whether it is triglyceride or ethyl ester form is not stated. The EPA to DHA ratio is not stated.",
  "daily_dose": "1000 mg EPA+DHA combined per day (not total oil mass)",
  "dose_note": "This audit assumes 1000 mg/day of EPA plus DHA combined, as supplied. That is the active omega-3 amount, not the total fish oil weight. The number of capsules per serving is unknown, but the daily total was supplied, so no regimen was inferred. The big prevention trials, VITAL and ASCEND, gave one 1 g capsule a day containing 840 mg EPA+DHA. In VITAL that was 460 mg EPA and 380 mg DHA, as the prescription ethyl ester Omacor. So this product gives about 160 mg/day more EPA+DHA than the trials that tested and found no benefit. REDUCE-IT and STRENGTH gave 4 g/day of prescription drugs. That is 4 times this product's dose, and in REDUCE-IT it was purified EPA only. Those results do not transfer to this product.",
  "for_whom": {
    "reasonable": "Nobody has been shown to avoid a first heart attack or stroke by taking 1 g/day fish oil. Large trials in people over 50 and in people with diabetes found no clear benefit. Someone who eats little fish has, at most, an unconfirmed subgroup signal.",
    "not_shown": "Adults without heart disease, including people with diabetes: 840 mg/day EPA+DHA was tested in 41,351 people for 5 to 7 years with no clear drop in major heart events. Adults under 50 have never been tested.",
    "source": "AHA Science Advisory (Siscovick et al., Circulation 2017), as reported by TCTMD: 'Fish oil is not recommended for the prevention of cardiovascular disease in patients with diabetes, nor is it recommended for individuals at high cardiovascular risk.' A search snippet of the NIH ODS fact sheet says VITAL and ASCEND did not show heart benefits. Cochrane CD003177.pub5 (2020) found little or no effect on cardiovascular events."
  },
  "outcomes": [
    {
      "name": "Heart attack and stroke prevention",
      "population": "Adults 50+ without heart disease (general)",
      "sentence": "In 25,871 adults over 50 with no heart disease, 1 g/day fish oil for 5.3 years did not cut heart attacks, strokes or heart deaths (HR 0.92).",
      "ledger": {
        "effectPoints": "0",
        "effect_basis": "VITAL (10.1056/NEJMoa1811403) is the only large trial in a general population that was not selected for high risk. People took 840 mg/day EPA+DHA or placebo for a median 5.3 years. A major cardiovascular event occurred in 386 people on omega-3 and 419 on placebo, HR 0.92 (95% CI 0.80 to 1.06). There was also no difference in cardiovascular or all-cause death. Heart attack alone was lower, HR 0.72 (95% CI 0.59 to 0.90), 145 vs 200 events. But that was a secondary endpoint among about 24 comparisons, so it may be chance (AAFP summary). Pooled analyses that mix in people who already had heart disease find small relative reductions. Hu 2019 (10.1161/JAHA.119.013543) reported MI RR 0.92 (0.86 to 0.99) and total CVD RR 0.97 (0.94 to 0.99) without REDUCE-IT. Cochrane 2020 (10.1002/14651858.CD003177.pub5) reported cardiovascular events RR 0.96 (0.92 to 1.01), rated high certainty. Neither reports a result for primary prevention on its own. Tier 0 because the main prevention endpoint was tested and not changed. Any true effect at this dose is at most a few percent relative and a fraction of a percentage point absolute. On the harm side, trials at 1 g/d or less showed slightly more atrial fibrillation (an irregular heartbeat), HR 1.12 (1.03 to 1.22) (Gencer 2021). In VITAL alone it was HR 1.09 (0.96 to 1.24).",
        "bodyIsRct": true,
        "checklist": {
          "risk_of_bias": "supported",
          "consistency": "supported",
          "precision": "concern",
          "directness": "supported",
          "publication_bias": "supported"
        },
        "gates": {
          "rctCount": 1,
          "largestRctN": 25871,
          "longestRctWeeks": 276,
          "chronicOutcome": true,
          "surrogate": false,
          "allPositiveIndustryOrOneLab": false
        },
        "formFit": "3",
        "doseFit": "4",
        "effective_daily_range": "No dose has been shown to prevent a first heart event in a general population. The dose tested was 840 mg/day EPA+DHA, and it found no clear benefit. This product's 1000 mg/day is close to that tested dose."
      },
      "detail": {
        "effect": {
          "found": "Major heart events: 386 of about 12,900 on fish oil vs 419 of about 12,900 on placebo, HR 0.92 (0.80 to 1.06). That works out to about 3.0% vs 3.2% over 5.3 years (my estimate from the counts). Heart attacks alone: 145 vs 200, HR 0.72 (0.59 to 0.90). That was a secondary result.",
          "missing": "The confidence interval runs from a 20% drop to a 6% rise, so a small true benefit cannot be ruled out. The heart attack finding was never confirmed as a main result.",
          "move": "A second large placebo-controlled trial in healthy adults at about 1 g/day, with heart attack as the main endpoint."
        },
        "evidence": {
          "found": "One very large, NIH-funded, double-blind trial (VITAL, 25,871 people, median 5.3 years). Cochrane 2020 pooled 86 trials and 162,796 people and found little or no effect on cardiovascular events (high certainty). Hu 2019 pooled 13 trials and 127,477 people and found small drops, mostly from trials in people who already had heart disease.",
          "missing": "Neither meta-analysis gives a pooled result for people without heart disease only. I read VITAL only as an abstract and secondary reports.",
          "move": "An individual-patient meta-analysis limited to primary prevention trials."
        },
        "form": {
          "found": "VITAL used Omacor, a 1 g ethyl ester capsule with 460 mg EPA and 380 mg DHA. This product is fish oil with EPA+DHA, but its chemical form and ratio are unknown.",
          "missing": "Nobody has run a head-to-head heart outcome trial of triglyceride vs ethyl ester fish oil.",
          "move": "The label stating the ester form and the EPA to DHA split."
        },
        "dose": {
          "found": "The trial dose was 840 mg/day EPA+DHA. This product gives 1000 mg/day, about 19% more.",
          "missing": "No effective dose has been established for this population. Higher doses (4 g/day) were tested only in high-risk people.",
          "move": "A trial at 1 to 2 g/day EPA+DHA in healthy adults."
        }
      },
      "inventory": [
        {
          "id": "10.1056/NEJMoa1811403",
          "year": 2019,
          "design": "rct",
          "n": 25871,
          "direction": "none",
          "funding": "independent",
          "access": "abstract",
          "note": "VITAL. Men 50 and over, women 55 and over, no CVD. 840 mg/day EPA+DHA (Omacor) vs placebo, 2x2 with vitamin D. Major CV events 386 vs 419. HR 0.92 (0.80 to 1.06) from the secondary report. NIH-funded. The capsule maker supplied the study agents.",
          "pooled_in": "10.1161/JAHA.119.013543"
        },
        {
          "id": "10.1161/JAHA.119.013543",
          "year": 2019,
          "design": "sr_ma",
          "n": 127477,
          "direction": "benefit",
          "funding": "independent",
          "access": "full_text",
          "note": "13 RCTs, doses 376 to 4000 mg/d. Without REDUCE-IT: MI RR 0.92 (0.86 to 0.99), CVD death 0.93 (0.88 to 0.99), stroke 1.05 (0.98 to 1.14), major vascular events 0.97 (0.94 to 1.00). Most included trials enrolled people who already had heart disease or were at high risk. No primary-prevention-only result."
        },
        {
          "id": "10.1002/14651858.CD003177.pub5",
          "year": 2020,
          "design": "sr_ma",
          "n": 162796,
          "direction": "none",
          "funding": "independent",
          "access": "abstract",
          "note": "Cochrane, 86 RCTs. Long-chain omega-3: CV events RR 0.96 (0.92 to 1.01), all-cause death 0.97 (0.93 to 1.01), both high certainty. CHD death 0.90 and CHD events 0.91, low certainty. Includes trials in people with and without heart disease."
        },
        {
          "id": "10.1001/jama.2021.1489",
          "year": 2021,
          "design": "rct",
          "n": 24127,
          "direction": "none",
          "funding": "independent",
          "access": "abstract",
          "note": "VITAL Rhythm. Incident atrial fibrillation 469 (3.7%) vs 431 (3.4%), HR 1.09 (0.96 to 1.24), P=.19. Same participants as VITAL.",
          "pooled_in": "10.1161/CIRCULATIONAHA.121.055654"
        },
        {
          "id": "10.1161/CIRCULATIONAHA.121.055654",
          "year": 2021,
          "design": "sr_ma",
          "n": 81210,
          "direction": "harm",
          "funding": "independent",
          "access": "abstract",
          "note": "7 CV outcome RCTs. AF HR 1.25 (1.07 to 1.46). Trials at 1 g/d or less: HR 1.12 (1.03 to 1.22). Trials above 1 g/d: HR 1.49 (1.04 to 2.15). P for interaction <0.001."
        },
        {
          "id": "10.1136/bmjmed-2022-000451",
          "year": 2024,
          "design": "cohort",
          "n": 415737,
          "direction": "harm",
          "funding": "unknown",
          "access": "abstract",